{"$schema": "https://raw.githubusercontent.com/guitaripod/wwdc-sessions/master/schema/transcript.schema.json", "id": "wwdc2020-10200", "language": "eng", "source": "https://developer.apple.com/videos/play/wwdc2020/10200", "wordCount": 1051, "segments": [{"start": 3.0, "text": "Hello and welcome to WWDC."}, {"start": 8.0, "text": "Hi, my name is Radhika, and I work on the Proactive Intelligence team here at Apple."}, {"start": 13.0, "text": "As JP just mentioned in the previous video,"}, {"start": 16.0, "text": "it's clear that the intelligent system experience"}, {"start": 18.0, "text": "provides a lot of value for the developer."}, {"start": 21.0, "text": "Now, we'll look at how this benefits users."}, {"start": 24.0, "text": "To do this, let's walk through how system intelligence"}, {"start": 26.0, "text": "can actually help people, even before they download an app,"}, {"start": 30.0, "text": "and how it can help through every step of the way"}, {"start": 33.0, "text": "from someone who's just starting to use an app"}, {"start": 35.0, "text": "to becoming a power user."}, {"start": 38.0, "text": "To illustrate this, we'll use something relatable,"}, {"start": 41.0, "text": "like breaking up the workweek by doing some exercise."}, {"start": 44.0, "text": "I'll tell this story from the perspective of someone that's just starting to learn"}, {"start": 47.0, "text": "how to take advantage of all the cool stuff on their phone."}, {"start": 50.0, "text": "Let's say this person always works out with a friend."}, {"start": 54.0, "text": "That friend might text them"}, {"start": 55.0, "text": "with the address of a new gym they're going to today."}, {"start": 58.0, "text": "And before they even type the address in Maps,"}, {"start": 61.0, "text": "there's a suggestion to get driving directions to that gym"}, {"start": 65.0, "text": "that's just a tap away right there in Maps."}, {"start": 68.0, "text": "So again, no gym app installed yet,"}, {"start": 71.0, "text": "but Maps is smart enough to pick up on the location of the gym from Messages."}, {"start": 75.0, "text": "Pretty cool, right?"}, {"start": 76.0, "text": "Let's say she arrives with her friend at this gym"}, {"start": 79.0, "text": "and they decide they want to do a workout class together."}, {"start": 82.0, "text": "They don't really know what classes are available at this gym,"}, {"start": 85.0, "text": "so they're looking for the gym's class schedule."}, {"start": 87.0, "text": "Starting with iOS 14, there'll be an App Clip for that."}, {"start": 91.0, "text": "She could walk past the same reception desk every day,"}, {"start": 94.0, "text": "but this time, there could be an NFC tag for an App Clip at the register."}, {"start": 98.0, "text": "By just holding her phone close to the tag,"}, {"start": 101.0, "text": "she could see the schedule just like it would appear in the gym's app"}, {"start": 104.0, "text": "but without needing to hunt down and download something."}, {"start": 108.0, "text": "What's really cool is that if she finds this particular App Clip useful,"}, {"start": 112.0, "text": "there's a way to download the full app right there."}, {"start": 116.0, "text": "Now, this imaginary gym rat has gone from going to the gym without an app"}, {"start": 120.0, "text": "to realizing how the App Clip can help her plan out her week."}, {"start": 123.0, "text": "In fact, she might want to start picking the day she wants to go to the gym"}, {"start": 127.0, "text": "based on what classes are scheduled."}, {"start": 129.0, "text": "So, she ends up downloading the app."}, {"start": 132.0, "text": "Now, she's starting to plan ahead."}, {"start": 135.0, "text": "Discovering this app helped her solve a problem"}, {"start": 137.0, "text": "she didn't even know she had."}, {"start": 139.0, "text": "Our new app user is now being far more proactive"}, {"start": 142.0, "text": "in building healthy habits and creating an intentional schedule."}, {"start": 145.0, "text": "She's started planning out her week on Sunday mornings,"}, {"start": 148.0, "text": "which is a very responsible thing to do."}, {"start": 150.0, "text": "In fact, she's gotten even faster at opening her apps"}, {"start": 154.0, "text": "by pulling down to reveal Search."}, {"start": 156.0, "text": "And lo and behold, when she pulls down, even before she starts typing,"}, {"start": 160.0, "text": "the app is waiting for her right there in Siri Suggestions."}, {"start": 165.0, "text": "That's because Siri can actually learn and predict"}, {"start": 168.0, "text": "what app she wants to launch based on how she uses her phone."}, {"start": 172.0, "text": "So, she has the app on her device,"}, {"start": 174.0, "text": "and she's starting to use the various features within the app,"}, {"start": 177.0, "text": "like looking at the yoga schedule and finding new classes she can try out."}, {"start": 181.0, "text": "She's pretty familiar with the app,"}, {"start": 183.0, "text": "and can get to the information she needs most of the time."}, {"start": 187.0, "text": "She's really into yoga."}, {"start": 188.0, "text": "So even though she has her week planned,"}, {"start": 190.0, "text": "she's always trying to squeeze in an extra yoga class."}, {"start": 194.0, "text": "She usually checks the yoga schedule after work by going into the app,"}, {"start": 197.0, "text": "but recently, she's been using the timely shortcut suggestions."}, {"start": 202.0, "text": "She can jump right to the yoga schedule by tapping on it in Search."}, {"start": 206.0, "text": "It ends up saving her a couple of steps, and most importantly,"}, {"start": 209.0, "text": "she can probably get in some extra yoga time."}, {"start": 213.0, "text": "So, our friend is now pretty accustomed with the app"}, {"start": 216.0, "text": "and is really loving her new gym routine."}, {"start": 218.0, "text": "There have been some hiccups, though,"}, {"start": 220.0, "text": "so she's looking for ways to make things even easier for herself."}, {"start": 224.0, "text": "She ended up missing a group class recently"}, {"start": 227.0, "text": "because she didn't notice a schedule update."}, {"start": 229.0, "text": "With a busy workweek, she didn't end up checking the app frequently enough."}, {"start": 234.0, "text": "Luckily, this year, with the new widgets,"}, {"start": 236.0, "text": "there's an intelligent experience available right on her Home Screen."}, {"start": 241.0, "text": "With a few quick taps,"}, {"start": 242.0, "text": "she can create a Smart Stack with all her favorite widgets,"}, {"start": 245.0, "text": "including Mission Gym, and add it to her Home Screen."}, {"start": 249.0, "text": "Thanks to system intelligence, the stack will rotate automatically"}, {"start": 253.0, "text": "to show the most relevant and timely widget."}, {"start": 256.0, "text": "So, in her case, if the class schedule changes,"}, {"start": 259.0, "text": "the stack will automatically rotate to the gym widget,"}, {"start": 262.0, "text": "giving her enough time to react to any changes."}, {"start": 265.0, "text": "This way she'll never miss a class."}, {"start": 268.0, "text": "More importantly, in the future,"}, {"start": 270.0, "text": "she can browse upcoming class times directly on her Home Screen"}, {"start": 273.0, "text": "by glancing at the widget and picking a time that works for her."}, {"start": 276.0, "text": "If she wants to learn more,"}, {"start": 278.0, "text": "she can always tap on the widget to jump to the right place in the app."}, {"start": 282.0, "text": "So instead of looking for the app and then navigating through it,"}, {"start": 285.0, "text": "she can find everything right on her Home Screen."}, {"start": 289.0, "text": "Our friend has been working out pretty frequently now."}, {"start": 292.0, "text": "She did notice, however, she has been repeating the same few things"}, {"start": 295.0, "text": "right before she works out."}, {"start": 297.0, "text": "She always checks the bus schedule before starting the workout,"}, {"start": 300.0, "text": "and she uses the Mission Gym app to track her exercise."}, {"start": 303.0, "text": "This is where Shortcuts is bound to come in handy."}, {"start": 307.0, "text": "She can set up a Shortcut automation that will run when she arrives at the gym."}, {"start": 311.0, "text": "So when she gets there,"}, {"start": 313.0, "text": "she can see the bus schedule and start her workout."}, {"start": 316.0, "text": "So, as you can see through this user's journey,"}, {"start": 319.0, "text": "system intelligence can help people discover new apps"}, {"start": 322.0, "text": "and accelerate them every step of the way after that."}, {"start": 327.0, "text": "By leveraging these intelligence touch points,"}, {"start": 329.0, "text": "you can work with the system"}, {"start": 331.0, "text": "to deliver better, more holistic experience for your users"}, {"start": 335.0, "text": "at the right time and place."}, {"start": 337.0, "text": "Now, I'm going to hand it over to my colleague Sufiyan"}, {"start": 339.0, "text": "who will talk about the underlying technologies"}, {"start": 342.0, "text": "that power all of these experiences."}]}
