{"id": "wwdc2021-10318", "language": "eng", "source": "https://developer.apple.com/videos/play/wwdc2021/10318", "wordCount": 917, "segments": [{"start": 1.0, "text": "Accessibility is more about including all people"}, {"start": 6.0, "text": "because everyone has a different way"}, {"start": 8.0, "text": "of accessing the world."}, {"start": 13.0, "text": "♪ ♪"}, {"start": 20.0, "text": "In 2009, I lost my eyesight"}, {"start": 23.0, "text": "and became suddenly and instantaneously interested"}, {"start": 28.0, "text": "in accessibility."}, {"start": 29.0, "text": "Since I first started at Avid, we were trying"}, {"start": 32.0, "text": "to improve accessibility into our products and services."}, {"start": 37.0, "text": "I was born deaf. I’ve been deaf my whole life."}, {"start": 39.0, "text": "My world experience, my lived experience"}, {"start": 42.0, "text": "has been deaf all the way."}, {"start": 44.0, "text": "So my world is visual."}, {"start": 48.0, "text": "There’s no audio in my life."}, {"start": 51.0, "text": "The way that influences my work is that it forces me"}, {"start": 54.0, "text": "to look at how apps run and consider the experience"}, {"start": 57.0, "text": "of running them without audio."}, {"start": 59.0, "text": "I’m blind, and, day-to-day,"}, {"start": 62.0, "text": "I develop code just like anyone else would,"}, {"start": 65.0, "text": "using the same tools plus a screen reader."}, {"start": 73.0, "text": "Each day I’m motivated by the power of technology"}, {"start": 77.0, "text": "to improve people’s lives,"}, {"start": 79.0, "text": "and for people with disabilities,"}, {"start": 81.0, "text": "you can really close the gap"}, {"start": 83.0, "text": "between what someone is capable of doing"}, {"start": 85.0, "text": "and what their current environment"}, {"start": 87.0, "text": "and situation allows them to do."}, {"start": 90.0, "text": "When you’re developing and driving accessibility"}, {"start": 92.0, "text": "into products, attention to accessibility"}, {"start": 95.0, "text": "has more impact and reach than any of us can imagine."}, {"start": 98.0, "text": "And with a billion people in the world"}, {"start": 100.0, "text": "with some form of disability, it’s not a niche audience."}, {"start": 103.0, "text": "And you want them all to walk up to the app"}, {"start": 106.0, "text": "and use it the same way."}, {"start": 107.0, "text": "You don’t want the blind version of Pro Tools"}, {"start": 109.0, "text": "for these other guys."}, {"start": 110.0, "text": "You want to have one universally accessible version"}, {"start": 113.0, "text": "of the tool that everyone can walk up and use."}, {"start": 116.0, "text": "The biggest misconception that people have"}, {"start": 118.0, "text": "about making apps accessible"}, {"start": 121.0, "text": "is thinking that it’s a lot of work"}, {"start": 122.0, "text": "and it’s really difficult, but it’s not."}, {"start": 125.0, "text": "Yeah, I remember once there was"}, {"start": 127.0, "text": "an app that was completely inaccessible"}, {"start": 130.0, "text": "because there weren’t labels"}, {"start": 131.0, "text": "on any of the graphical buttons."}, {"start": 133.0, "text": "And I got in touch with the developer,"}, {"start": 136.0, "text": "and I pointed them to some resources"}, {"start": 138.0, "text": "and explained why this was a problem."}, {"start": 140.0, "text": "And with, you know, just a day’s work,"}, {"start": 143.0, "text": "he was able to add those labels,"}, {"start": 145.0, "text": "and the app became mostly accessible."}, {"start": 148.0, "text": "It’s a long-term investment in good design"}, {"start": 150.0, "text": "for usability and accessibility."}, {"start": 153.0, "text": "Takes a lot of input from all over the company"}, {"start": 156.0, "text": "and from external beta testers."}, {"start": 158.0, "text": "It’s really important to have your teams"}, {"start": 160.0, "text": "be reflective of all the different types"}, {"start": 164.0, "text": "of people in the world because if you have"}, {"start": 167.0, "text": "that diversity on your team,"}, {"start": 169.0, "text": "you’re going to solve problems in better ways"}, {"start": 172.0, "text": "and create better products."}, {"start": 174.0, "text": "One thing I’d like to emphasize"}, {"start": 176.0, "text": "is that the tools themselves need to be accessible."}, {"start": 180.0, "text": "I can give you an example."}, {"start": 183.0, "text": "I received a bug report regarding a problem"}, {"start": 187.0, "text": "with the VoiceOver feature on our app."}, {"start": 189.0, "text": "It happened to be the first bug assigned to me on this job,"}, {"start": 191.0, "text": "and I wondered for a moment--"}, {"start": 193.0, "text": "how can I test this if I can’t hear it?"}, {"start": 196.0, "text": "So I checked the settings on the phone"}, {"start": 198.0, "text": "and found that VoiceOver provides a caption bar."}, {"start": 204.0, "text": "Tweets and replies, Button."}, {"start": 207.0, "text": "Media, Button. Likes, Button."}, {"start": 210.0, "text": "My point is that someone at Apple"}, {"start": 213.0, "text": "recognized this and made a decision"}, {"start": 214.0, "text": "to add that caption bar, which allows me"}, {"start": 217.0, "text": "to do my work, and, in turn,"}, {"start": 219.0, "text": "improve the experience for more people."}, {"start": 222.0, "text": "The Seeing AI project, in many ways,"}, {"start": 224.0, "text": "was born out of that personal need."}, {"start": 226.0, "text": "It describes the world around you"}, {"start": 229.0, "text": "including reading text and identifying people"}, {"start": 232.0, "text": "and objects around you."}, {"start": 234.0, "text": "Chair, laptop, table."}, {"start": 236.0, "text": "Plant, cup, chair, chair, plant."}, {"start": 239.0, "text": "Early on we realized that we needed to provide"}, {"start": 243.0, "text": "more audio guidance on how to point the camera,"}, {"start": 246.0, "text": "and so, one of our team members came up with the idea,"}, {"start": 249.0, "text": "when scanning a barcode, to use a kid’s game"}, {"start": 253.0, "text": "of “hot or cold” so that the beeps"}, {"start": 257.0, "text": "get faster the closer you are."}, {"start": 264.0, "text": "Processing."}, {"start": 265.0, "text": "Smucker’s seedless blackberry jam."}, {"start": 267.0, "text": "Back when I was taking cabs"}, {"start": 269.0, "text": "from wherever I was to return home,"}, {"start": 272.0, "text": "I’d use the Notes app to communicate to the driver,"}, {"start": 277.0, "text": "but the text was so tiny, and the drivers"}, {"start": 279.0, "text": "had a hard time reading it, and I thought,"}, {"start": 281.0, "text": "\"I really need something that can enlarge the text"}, {"start": 283.0, "text": "and make it easy to read and speed up our communication.\""}, {"start": 286.0, "text": "So I developed an app called Cardzilla."}, {"start": 295.0, "text": "The thing that makes me excited is people"}, {"start": 297.0, "text": "using our tools that have disabilities"}, {"start": 299.0, "text": "but they’re using them with the same facility"}, {"start": 302.0, "text": "and energy and proficiency as sighted people."}, {"start": 306.0, "text": "So, let’s make some music!"}, {"start": 308.0, "text": "Okay, so here we have the interface."}, {"start": 314.0, "text": "A really nice note we received is from a father"}, {"start": 317.0, "text": "who took his son to the zoo, and they were having a nice day,"}, {"start": 321.0, "text": "but the father said it really became magical"}, {"start": 324.0, "text": "when he could use Seeing AI"}, {"start": 326.0, "text": "to read the signs, and therefore he was listening"}, {"start": 330.0, "text": "to information about the orangutans,"}, {"start": 333.0, "text": "and now he could tell his son about that,"}, {"start": 335.0, "text": "and they could share that experience together."}, {"start": 338.0, "text": "Or from parents who used it to recognize"}, {"start": 341.0, "text": "their children’s handwritten homework."}, {"start": 343.0, "text": "And I love this."}, {"start": 345.0, "text": "It’s one of the most favorite parts"}, {"start": 346.0, "text": "of my job is hearing from users."}, {"start": 348.0, "text": "We had a family gathering,"}, {"start": 351.0, "text": "and my grandmother was there."}, {"start": 354.0, "text": "I had just finished developing the app at the time"}, {"start": 356.0, "text": "and I showed it to her,"}, {"start": 357.0, "text": "and she was really excited about it."}, {"start": 360.0, "text": "She said, \"Finally, I can really talk to you.\""}, {"start": 364.0, "text": "She could just hit the dictate button and speak,"}, {"start": 366.0, "text": "and we could have an interactive conversation."}, {"start": 368.0, "text": "By making tools more accessible,"}, {"start": 370.0, "text": "developers are making the world"}, {"start": 372.0, "text": "a more inclusive and loving place."}, {"start": 373.0, "text": "[upbeat music]"}]}