{"id": "wwdc2024-111977", "language": "eng", "source": "https://developer.apple.com/videos/play/wwdc2024/111977", "wordCount": 755, "segments": [{"start": 2.0, "text": "Welcome to the WWDC 24 Platforms State of the Union!"}, {"start": 7.0, "text": "WWDC is always an exciting time of year when we dig into the technical details"}, {"start": 11.0, "text": "of what we've been working on, share how it works,"}, {"start": 14.0, "text": "and help you understand what's possible in your apps and games."}, {"start": 18.0, "text": "today marks the beginning of an exciting chapter"}, {"start": 21.0, "text": "with Apple Intelligence."}, {"start": 24.0, "text": "Apple Intelligence is the personal intelligence system,"}, {"start": 27.0, "text": "bringing powerful generative models to our platforms."}, {"start": 30.0, "text": "iOS, iPadOS, and macOS get powerful new capabilities"}, {"start": 34.0, "text": "and helping users take actions, all with rich awareness"}, {"start": 38.0, "text": "of users' personal context."}, {"start": 40.0, "text": "If you're using any of the standard UI frameworks to render text fields,"}, {"start": 45.0, "text": "your app will automatically get Writing Tools!"}, {"start": 47.0, "text": "And using our new TextView delegate API, you can customize how you want"}, {"start": 51.0, "text": "your app to behave while Writing Tools is active,"}, {"start": 54.0, "text": "Genmoji opens up entirely new ways to communicate,"}, {"start": 58.0, "text": "and new Image Playground API"}, {"start": 60.0, "text": "delivers a consistent, playful, and easy-to-use experience."}, {"start": 65.0, "text": "As Swift continues to evolve, it's becoming a compelling choice"}, {"start": 68.0, "text": "for even the most performance-sensitive and secure code."}, {"start": 72.0, "text": "This year, Swift celebrates its 10th birthday!"}, {"start": 77.0, "text": "Swift's safety, speed, and approachability,"}, {"start": 80.0, "text": "combined with built-in C and C++ interoperability,"}, {"start": 84.0, "text": "mean Swift is the best choice to succeed C++."}, {"start": 88.0, "text": "By enabling you to express what you want, not how to build it,"}, {"start": 92.0, "text": "SwiftUI lets you share more of your code across more devices."}, {"start": 96.0, "text": "And we're continuing to make multi-year investments to the developer experience."}, {"start": 100.0, "text": "This year, we focused on previews, customizations, and interoperability."}, {"start": 105.0, "text": "Previews has a new dynamic linking architecture"}, {"start": 108.0, "text": "that uses the same build artifacts for previews and when you build-and-run."}, {"start": 112.0, "text": "SwiftUI has also gained a number of customizations"}, {"start": 115.0, "text": "to fine-tune the look and feel of your apps,"}, {"start": 117.0, "text": "and this year, all our UI frameworks share more common foundations."}, {"start": 122.0, "text": "Xcode 16 begins a whole new chapter for development,"}, {"start": 125.0, "text": "as we infuse our tools with the power of Generative Models."}, {"start": 129.0, "text": "It starts with a major leap forward in a core feature that you use every day,"}, {"start": 134.0, "text": "Code completion,"}, {"start": 135.0, "text": "with an innovative new engine that can predict the code you need."}, {"start": 139.0, "text": "It uses your project symbols to customize suggestions."}, {"start": 143.0, "text": "And it runs locally on your Mac, keeping your code private,"}, {"start": 146.0, "text": "giving you super-fast results, and even works when you're offline."}, {"start": 150.0, "text": "Building an app is more than just typing code."}, {"start": 153.0, "text": "It's about transforming entire ideas into code."}, {"start": 157.0, "text": "And the easiest way to do that is with natural language."}, {"start": 160.0, "text": "So we created a larger and more powerful model that runs in the cloud."}, {"start": 165.0, "text": "Introducing Swift Assist, a companion for all your coding tasks."}, {"start": 170.0, "text": "Swift Assist can answer your coding questions"}, {"start": 172.0, "text": "and help with tasks like experimenting with new APIs."}, {"start": 175.0, "text": "So now, tasks like exploring new frameworks"}, {"start": 178.0, "text": "and experimenting with new ideas are just one request away."}, {"start": 183.0, "text": "Xcode 16 also has many other new features to make you more productive"}, {"start": 187.0, "text": "and improve the quality of your apps,"}, {"start": 189.0, "text": "things like a single view of your backtraces,"}, {"start": 191.0, "text": "a \"flame graph\" of your profiling data in Instruments,"}, {"start": 194.0, "text": "and enhancements to localization catalogs,"}, {"start": 196.0, "text": "so you can bring your app to even more people around the world."}, {"start": 200.0, "text": "What an exciting time to be developing for Apple platforms."}, {"start": 204.0, "text": "Controls can toggle a setting, execute an action,"}, {"start": 207.0, "text": "or deep link right to a specific experience."}, {"start": 210.0, "text": "Using the new Controls API,"}, {"start": 212.0, "text": "Users can also assign your control to the Action button"}, {"start": 215.0, "text": "or, for the first time, to appear as one of the controls on their Lock Screen."}, {"start": 220.0, "text": "An app icons and widgets can now appear Light, Dark, or with a Tint."}, {"start": 225.0, "text": "This treatment is applied to all app icons,"}, {"start": 228.0, "text": "and is crafted intelligently to preserve your design intent"}, {"start": 231.0, "text": "and maintain legibility."}, {"start": 232.0, "text": "With the incredible pace of innovation in Metal and Apple silicon,"}, {"start": 236.0, "text": "Every Apple silicon Mac, every iPad with an M-series chip,"}, {"start": 240.0, "text": "and even iPhone 15 Pro can play the type of games that previously required"}, {"start": 244.0, "text": "dedicated gaming systems with power-hungry discrete GPUs."}, {"start": 249.0, "text": "With Game Porting Toolkit 2, you can now evaluate"}, {"start": 251.0, "text": "even more Windows games thanks to improved compatibility"}, {"start": 255.0, "text": "with technologies like AVX2"}, {"start": 257.0, "text": "and advanced gaming features like ray tracing."}, {"start": 259.0, "text": "Developers from across the world"}, {"start": 261.0, "text": "have been building incredible spatial apps for visionOS."}, {"start": 264.0, "text": "For example, djay started with their SwiftUI-based iPad app,"}, {"start": 268.0, "text": "easily recompiled to run on visionOS,"}, {"start": 271.0, "text": "and then extended it for spatial computing,"}, {"start": 274.0, "text": "Whether you already have a visionOS app or are new to the platform,"}, {"start": 277.0, "text": "spatial computing provides incredible opportunities for your apps."}, {"start": 282.0, "text": "We are grateful that you are part of the Apple developer community,"}, {"start": 286.0, "text": "and we're excited to see you bring these technologies to life"}, {"start": 290.0, "text": "in your amazing apps and games."}]}