{"$schema": "https://raw.githubusercontent.com/guitaripod/wwdc-sessions/master/schema/transcript.schema.json", "id": "wwdc2020-10034", "language": "eng", "source": "https://developer.apple.com/videos/play/wwdc2020/10034", "wordCount": 1087, "segments": [{"start": 3.0, "text": "Hello and welcome to WWDC."}, {"start": 8.0, "text": "Hi, I'm Izzy. I'm an engineer on the iOS System Experience team."}, {"start": 12.0, "text": "Thanks for joining me."}, {"start": 14.0, "text": "Let's take a look at what we will be covering today."}, {"start": 16.0, "text": "This is a code-along, a new format for WWDC 2020."}, {"start": 20.0, "text": "We'll go over what that means and how you can participate,"}, {"start": 23.0, "text": "we'll cover the core concept of what a widget is,"}, {"start": 26.0, "text": "and then we'll build our first widget together."}, {"start": 29.0, "text": "I'm excited. Let's get started."}, {"start": 32.0, "text": "This session is a code-along."}, {"start": 33.0, "text": "There's a project available on the developer portal we'll start with,"}, {"start": 36.0, "text": "and we will build a widget for it from scratch together."}, {"start": 40.0, "text": "I invite you to start that download now,"}, {"start": 42.0, "text": "and while that's going, we'll cover a couple concepts."}, {"start": 45.0, "text": "What is a widget at its core?"}, {"start": 48.0, "text": "A widget is just a SwiftUI view. SwiftUI."}, {"start": 51.0, "text": "So it's the same declarative code that generates gorgeous native views"}, {"start": 54.0, "text": "on iOS, iPadOS, and macOS."}, {"start": 59.0, "text": "And it's a SwiftUI view that updates over time."}, {"start": 62.0, "text": "Exactly how and when it updates is what we'll be looking at in this code-along."}, {"start": 69.0, "text": "So, this is the download project."}, {"start": 74.0, "text": "We're in the first part of our code-along, so let's open that project."}, {"start": 81.0, "text": "Before we get into the widget, let's build and run this to see what we have."}, {"start": 92.0, "text": "This is the Emoji Rangers app."}, {"start": 93.0, "text": "It lets us keep track of our favorite Emoji Rangers."}, {"start": 96.0, "text": "You can see we have Power Panda, Spouty and Egghead."}, {"start": 99.0, "text": "Let's look at their details."}, {"start": 102.0, "text": "Here we see that our Emoji Rangers are saving the world from waves of attacks."}, {"start": 106.0, "text": "Power Panda is recharging right now but will be ready soon."}, {"start": 110.0, "text": "I've seen the keynote, I've watched \"Welcome to WidgetKit,\""}, {"start": 112.0, "text": "and I'd really like a widget for this game."}, {"start": 114.0, "text": "It looks like we have the perfect view for it already."}, {"start": 117.0, "text": "The status square in the top left looks ideal for a widget, so let's make it one."}, {"start": 123.0, "text": "Let's check out how this view works in code first."}, {"start": 131.0, "text": "Here's our SwiftUI AvatarView."}, {"start": 133.0, "text": "If you're new to SwiftUI, widgets are a perfect place to get started."}, {"start": 136.0, "text": "You can see we have just a few lines of code to generate the widget we want,"}, {"start": 140.0, "text": "and because we're expressing the layout semantically with Stacks,"}, {"start": 143.0, "text": "SwiftUI knows how to set the padding just right for us."}, {"start": 146.0, "text": "You'll also notice on the right-hand side, there's a SwiftUI preview,"}, {"start": 150.0, "text": "which is a live representation overview that updates as we type."}, {"start": 154.0, "text": "It kind of looks like a widget already. Let's go ahead and make it one for real."}, {"start": 159.0, "text": "First, we need to create a widget target."}, {"start": 162.0, "text": "I do that by going to File, New, Target, and search for a widget."}, {"start": 173.0, "text": "Let's name it \"EmojiRanger Widget.\""}, {"start": 178.0, "text": "And finish."}, {"start": 181.0, "text": "Activate our target."}, {"start": 185.0, "text": "Now that we have our target, I know we want that view from earlier in it,"}, {"start": 189.0, "text": "and I'm going to add the files that I want to the target."}, {"start": 204.0, "text": "SwiftUI previews work for widgets as well. Let's take a look."}, {"start": 209.0, "text": "You can click the Create Preview to automatically insert a preview for us,"}, {"start": 213.0, "text": "and we can use that AvatarView."}, {"start": 225.0, "text": "In order to see exactly what it'll look like as a widget,"}, {"start": 228.0, "text": "we use the WidgetPreviewContext as an argument to the previewContext."}, {"start": 255.0, "text": "That looks great. It's almost like we already have a widget."}, {"start": 257.0, "text": "Making it real is just a matter of filling in some information."}, {"start": 263.0, "text": "We have a DisplayName and a Description that are easy to fill in."}, {"start": 279.0, "text": "Now let's look at our main EntryView..."}, {"start": 283.0, "text": "the EmojiRangerWidgetEntryView."}, {"start": 285.0, "text": "Let's use that AvatarView, which is what we previewed before."}, {"start": 291.0, "text": "Now, it wants me to pass a character in here,"}, {"start": 294.0, "text": "so where should that character come from?"}, {"start": 297.0, "text": "The EmojiRangersWidgetEntryView already comes with an entry,"}, {"start": 302.0, "text": "so let's add it to the entry."}, {"start": 310.0, "text": "And now I can pass it directly into my AvatarView."}, {"start": 317.0, "text": "But where does this entry come from?"}, {"start": 320.0, "text": "Entries come from a timeline provider, which is the core engine of a widget."}, {"start": 325.0, "text": "The timeline provider provides snapshots when WidgetKit wants just one entry,"}, {"start": 330.0, "text": "like in the Widget Gallery, and it provides a full timeline"}, {"start": 334.0, "text": "when the user has added a configured widget to their device."}, {"start": 338.0, "text": "So here, for the snapshot, all we need to do is pass a character."}, {"start": 342.0, "text": "We can pass our character in here."}, {"start": 348.0, "text": "Timeline is used once a user has actually added a widget from the gallery."}, {"start": 352.0, "text": "We don't need a full timeline right now, so let's just use one entry again."}, {"start": 364.0, "text": "Okay, that's great. Let's build and run, and see what we have."}, {"start": 373.0, "text": "I built my widget target,"}, {"start": 374.0, "text": "and it automatically added the widget to my Home Screen for me."}, {"start": 378.0, "text": "We have a full widget now, but I noticed some things I'd like to tweak."}, {"start": 382.0, "text": "First, in the Add sheet..."}, {"start": 386.0, "text": "...our widget has a small, medium, and large size."}, {"start": 391.0, "text": "These work okay, but it's not the best use of space right now,"}, {"start": 394.0, "text": "and I'm not ready to support those yet."}, {"start": 397.0, "text": "So let's set our supported families."}, {"start": 403.0, "text": "That's just an extra modifier on our widget configuration."}, {"start": 413.0, "text": "One other thing you may have noticed"}, {"start": 415.0, "text": "is that there's this PlaceholderView in our template."}, {"start": 419.0, "text": "Our widget is so fast that we can't actually see it,"}, {"start": 422.0, "text": "but this is what shows up while WidgetKit is waiting on a timeline."}, {"start": 425.0, "text": "We want it to be our AvatarView,"}, {"start": 427.0, "text": "and we can preview what that looks like with SwiftUI previews."}, {"start": 431.0, "text": "Let's make it our AvatarView."}, {"start": 433.0, "text": "There's no entry for the PlaceholderView, so we can pass in Panda again."}, {"start": 439.0, "text": "And now in our preview..."}, {"start": 443.0, "text": "we can make this a group..."}, {"start": 450.0, "text": "and we can add in our placeholder."}, {"start": 464.0, "text": "Now we have two views that look the same,"}, {"start": 466.0, "text": "but we want our placeholder to indicate pending content, not our actual content."}, {"start": 471.0, "text": "So there's new SwiftUI API that makes this super easy."}, {"start": 475.0, "text": "It's just the isPlaceholder modifier."}, {"start": 483.0, "text": "Now you can see in our previews,"}, {"start": 485.0, "text": "we have our full widget and a placeholder"}, {"start": 489.0, "text": "with our text automatically replaced with gray, rounded rectangles,"}, {"start": 493.0, "text": "and our image is automatically replaced as well."}, {"start": 498.0, "text": "Amazing."}, {"start": 501.0, "text": "Let's take one last look at our new widget."}, {"start": 506.0, "text": "Here's our Emoji Rangers app."}, {"start": 508.0, "text": "Now when I go to the Widget Gallery,"}, {"start": 511.0, "text": "I can see the single supported size, and I can add it right on my Home Screen."}, {"start": 517.0, "text": "Perfect."}, {"start": 519.0, "text": "For insight on how to approach widget design,"}, {"start": 521.0, "text": "see the \"Designing Great Widgets\" talk, and my teammate Nils is giving a talk"}, {"start": 525.0, "text": "about how to make the most of SwiftUI and widgets to really nail those designs."}, {"start": 529.0, "text": "I'd also love for you to join me in the next section of this code-along."}, {"start": 532.0, "text": "Thanks for joining me, and have a great WWDC."}]}
