{"$schema": "https://raw.githubusercontent.com/guitaripod/wwdc-sessions/master/schema/transcript.schema.json", "id": "wwdc2020-10185", "language": "eng", "source": "https://developer.apple.com/videos/play/wwdc2020/10185", "wordCount": 776, "segments": [{"start": 3.0, "text": "Hello and welcome to WWDC."}, {"start": 10.0, "text": "Hi, I'm Daisy, and I work on the Xcode Previews team."}, {"start": 13.0, "text": "In this video, I want to show you how you can use Xcode Previews"}, {"start": 16.0, "text": "to help you quickly build SwiftUI apps,"}, {"start": 18.0, "text": "whether you're new to SwiftUI or not."}, {"start": 20.0, "text": "To do so, I'll be building the row view for our smoothie app."}, {"start": 23.0, "text": "The view has the smoothie's name, ingredients, calorie count, and an image,"}, {"start": 27.0, "text": "along with the star count for its popularity."}, {"start": 30.0, "text": "To begin, I'm going to use a library to add a new view to my UI."}, {"start": 34.0, "text": "The library has SwiftUI views and modifiers,"}, {"start": 36.0, "text": "allowing you to keep your preview compiling"}, {"start": 38.0, "text": "without additional modifications."}, {"start": 42.0, "text": "SwiftUI uses structural layouts in order to make your app adaptive."}, {"start": 46.0, "text": "So your app looks great whether it's running on an iMac or an iPhone."}, {"start": 49.0, "text": "Xcode Previews lets you insert your content,"}, {"start": 52.0, "text": "and get the right layout container, all in one action."}, {"start": 56.0, "text": "Next, I can double-click on my \"Hello World\" view,"}, {"start": 58.0, "text": "which brings focus to the editor,"}, {"start": 60.0, "text": "allowing me to quickly modify the key component of my view,"}, {"start": 63.0, "text": "whether this is an image or text."}, {"start": 66.0, "text": "The Xcode Previews canvas and the source editor"}, {"start": 68.0, "text": "have a tight integration."}, {"start": 70.0, "text": "The canvas and the inspector help you write your Swift code faster,"}, {"start": 73.0, "text": "and any changes you do to source are immediately visible in the canvas."}, {"start": 85.0, "text": "To help you build your structure even quicker,"}, {"start": 87.0, "text": "you can use Command-D to duplicate your views."}, {"start": 90.0, "text": "Xcode Previews understands the structure of your code,"}, {"start": 93.0, "text": "so if you're duplicating a view that isn't in a container,"}, {"start": 95.0, "text": "it would insert one for you."}, {"start": 99.0, "text": "Next, we can double-click on our third label to quickly modify it."}, {"start": 102.0, "text": "Double-clicking on a view not only helps with replacing static content,"}, {"start": 105.0, "text": "but also makes integrating your model data a breeze."}, {"start": 116.0, "text": "To insert my image, I'm going to bring up the library"}, {"start": 118.0, "text": "using the keyboard shortcut Command-Shift-L."}, {"start": 122.0, "text": "The Xcode Previews canvas not only works with SwiftUI views and modifiers,"}, {"start": 125.0, "text": "but also your media,"}, {"start": 126.0, "text": "allowing you to use your images in your asset catalog with ease."}, {"start": 134.0, "text": "Our image is larger than expected."}, {"start": 136.0, "text": "This, however, makes sense, since SwiftUI renders your images"}, {"start": 139.0, "text": "in their true size."}, {"start": 141.0, "text": "To remedy this, we can use the inspector to locate the appropriate modifier."}, {"start": 145.0, "text": "Clicking on \"Add Modifier\" brings down a list of recommended suggestions"}, {"start": 149.0, "text": "using your current context,"}, {"start": 151.0, "text": "allowing you to quickly locate what you're looking for,"}, {"start": 153.0, "text": "and learn about modifiers commonly used with the view."}, {"start": 156.0, "text": "The image is now resizing, though its size is not up to spec."}, {"start": 160.0, "text": "In the inspector, I can add and edit common modifiers,"}, {"start": 163.0, "text": "allowing you to try various values"}, {"start": 164.0, "text": "without having to know the modifier's signature."}, {"start": 167.0, "text": "This immediately updates your code and renders in the canvas."}, {"start": 171.0, "text": "Next, I want to add the star view that indicates the smoothie's popularity."}, {"start": 176.0, "text": "Using your project's custom SwiftUI views and modifiers in the canvas"}, {"start": 179.0, "text": "is just as easy as using those provided by the library."}, {"start": 183.0, "text": "To see how to do this, see the session"}, {"start": 185.0, "text": "\"Adding Custom Views and Modifiers to the Xcode Library.\""}, {"start": 188.0, "text": "To repeat the star horizontally, Xcode Previews provides actions"}, {"start": 192.0, "text": "that embed the selected view in various containers."}, {"start": 194.0, "text": "The actions can be brought up by holding Command and clicking on the view."}, {"start": 198.0, "text": "In our case, we click \"Embed in HStack\" to embed in a horizontal container."}, {"start": 203.0, "text": "To repeat the star view,"}, {"start": 204.0, "text": "we can bring up the same menu and click \"Repeat.\""}, {"start": 210.0, "text": "I'd like to make my smoothie title pop."}, {"start": 213.0, "text": "Using the inspector, I can quickly try various font"}, {"start": 215.0, "text": "and weight values on my view,"}, {"start": 217.0, "text": "and preview the results immediately in the canvas."}, {"start": 221.0, "text": "That doesn't look exactly how I want."}, {"start": 224.0, "text": "To clear the modifier,"}, {"start": 225.0, "text": "I can click on the circular blue indicator next to the control."}, {"start": 229.0, "text": "Clearing the modifier returns it to its inherited value."}, {"start": 232.0, "text": "In this case, the font returns to the default SwiftUI font."}, {"start": 236.0, "text": "Next, I would like to edit the other labels,"}, {"start": 239.0, "text": "which, with the inspectors, is only a few clicks."}, {"start": 242.0, "text": "I can use the inspectors not only to edit properties of the modifiers,"}, {"start": 247.0, "text": "but also edit those of the view."}, {"start": 252.0, "text": "Screen real estate is a hot commodity,"}, {"start": 254.0, "text": "so Xcode Previews has an in-canvas inspector"}, {"start": 257.0, "text": "allowing you to close your side panel without losing any functionality."}, {"start": 261.0, "text": "To bring up the canvas inspector,"}, {"start": 263.0, "text": "hold Control-Option and click on the view you wish to inspect."}, {"start": 268.0, "text": "To help you preview across different configurations,"}, {"start": 271.0, "text": "in Xcode 12 we have introduced various preview-centric capabilities."}, {"start": 275.0, "text": "For example, we can now duplicate a preview with one click."}, {"start": 279.0, "text": "And since previews are just views, we can inspect them too."}, {"start": 289.0, "text": "In summary, some of the ways Xcode Previews helps you visually edit"}, {"start": 292.0, "text": "your SwiftUI views is through tight source editor integration,"}]}
